{
  "schema_version": "realtime-quote-contract-registry/v1",
  "suite": "realtime_quote",
  "status": "contract_frozen",
  "source_candidate": {
    "path": "benchmarks/candidates/v0.1/realtime_quote.cases.json",
    "sha256": "6803e0cbc12a1b40b541aaadf70cbda4c0c6e646a4c185a56a1cc1d4b16577ec",
    "case_count": 100
  },
  "source_coherence_policy": {
    "variant_rule": "one_complete_source_per_accepted_variant",
    "multiple_source_rule": "additional sources create alternative source-coherent accepted_variants only",
    "forbidden": [
      "average",
      "cross_source_field_splice"
    ],
    "required_receipt_fields": [
      "source_id",
      "source_name",
      "source_response_sha256",
      "provider_quote_timestamp",
      "captured_at",
      "market_session",
      "timezone",
      "currency",
      "unit",
      "freshness",
      "tick"
    ],
    "capture_failure": "case_data_not_scored"
  },
  "contracts": [
    {
      "case_id": "RTQ-001",
      "query_sha256": "e64d07612765437b4e5bfe36181fa91d066387ac62f0ab7c4f06f7dc22a6fccb",
      "contract_status": "contract_frozen",
      "evaluation_mode": "state_only",
      "expected_status": "needs_clarification"
    },
    {
      "case_id": "RTQ-002",
      "query_sha256": "99db13d3dd02daeb1d0785c3bef63b6f114b6c74374bfc6f3672582e0d06f3f4",
      "contract_status": "contract_frozen",
      "evaluation_mode": "state_only",
      "expected_status": "needs_clarification"
    },
    {
      "case_id": "RTQ-003",
      "query_sha256": "1291b98a11cc06b9b4a2803b9e1f28ce7cd6c0d437f4ea6fdbae2102171ffece",
      "contract_status": "contract_frozen",
      "evaluation_mode": "state_only",
      "expected_status": "needs_clarification"
    },
    {
      "case_id": "RTQ-004",
      "query_sha256": "b9b707472e3a2e7b40401fa703d0b1b856a4ee05f47bbc8904deac6a4033d7f0",
      "contract_status": "contract_frozen",
      "evaluation_mode": "state_only",
      "expected_status": "needs_clarification"
    },
    {
      "case_id": "RTQ-005",
      "query_sha256": "91a61eeeb5b2594fba758302ec061ed7bdeb926668e4da7ae8fa8660ab363fa2",
      "contract_status": "contract_frozen",
      "evaluation_mode": "state_only",
      "expected_status": "needs_clarification"
    },
    {
      "case_id": "RTQ-006",
      "query_sha256": "a1748f65f27222e5c2e8662f9957af9b641ec7d60198d538f9191107b7627bdf",
      "contract_status": "contract_frozen",
      "evaluation_mode": "state_only",
      "expected_status": "needs_clarification"
    },
    {
      "case_id": "RTQ-007",
      "query_sha256": "c306ac5ae53a3fba2e30452ea74f4707890573b080a6de1870dc3d1fbc18382d",
      "contract_status": "contract_frozen",
      "evaluation_mode": "state_only",
      "expected_status": "needs_clarification"
    },
    {
      "case_id": "RTQ-008",
      "query_sha256": "c061491015c6a04997690a6b31edc91600cdcb1aa16188fb55a8c5ae4af9d366",
      "contract_status": "contract_frozen",
      "evaluation_mode": "state_only",
      "expected_status": "needs_clarification"
    },
    {
      "case_id": "RTQ-009",
      "query_sha256": "c8beebe0cd9cc8789291239dba7b38c8f9be560ebe84f3239966e77770322ffd",
      "contract_status": "contract_frozen",
      "evaluation_mode": "state_only",
      "expected_status": "needs_clarification"
    },
    {
      "case_id": "RTQ-010",
      "query_sha256": "5a4bd425ca43e07e9647877f04737ca0bb15ae6a4c13ec109a74753b35c90ad2",
      "contract_status": "contract_frozen",
      "evaluation_mode": "state_only",
      "expected_status": "needs_clarification"
    },
    {
      "case_id": "RTQ-011",
      "query_sha256": "8448efdc7f883c0566b59b2f5929ee891b9037a2fabafd19d8d4e2b2de624681",
      "contract_status": "contract_frozen",
      "evaluation_mode": "runtime_snapshot",
      "expected_status": "success",
      "runtime_capture_required": true,
      "accepted_variant_policy": {
        "variant_rule": "one_complete_source_per_accepted_variant",
        "multiple_source_rule": "additional sources create alternative source-coherent accepted_variants only",
        "forbidden": [
          "average",
          "cross_source_field_splice"
        ],
        "required_receipt_fields": [
          "source_id",
          "source_name",
          "source_response_sha256",
          "provider_quote_timestamp",
          "captured_at",
          "market_session",
          "timezone",
          "currency",
          "unit",
          "freshness",
          "tick"
        ],
        "capture_failure": "case_data_not_scored"
      }
    },
    {
      "case_id": "RTQ-012",
      "query_sha256": "d06b5c93808badb1e8ae4fc38c6a94ed2088624b71907f5848aadb4337c5f35c",
      "contract_status": "contract_frozen",
      "evaluation_mode": "runtime_snapshot",
      "expected_status": "success",
      "runtime_capture_required": true,
      "accepted_variant_policy": {
        "variant_rule": "one_complete_source_per_accepted_variant",
        "multiple_source_rule": "additional sources create alternative source-coherent accepted_variants only",
        "forbidden": [
          "average",
          "cross_source_field_splice"
        ],
        "required_receipt_fields": [
          "source_id",
          "source_name",
          "source_response_sha256",
          "provider_quote_timestamp",
          "captured_at",
          "market_session",
          "timezone",
          "currency",
          "unit",
          "freshness",
          "tick"
        ],
        "capture_failure": "case_data_not_scored"
      }
    },
    {
      "case_id": "RTQ-013",
      "query_sha256": "5676f5d1acbed45d529ed90d0652747c6966a7d0c02d8a3c0d22b97d9fad74db",
      "contract_status": "contract_frozen",
      "evaluation_mode": "runtime_snapshot",
      "expected_status": "success",
      "runtime_capture_required": true,
      "accepted_variant_policy": {
        "variant_rule": "one_complete_source_per_accepted_variant",
        "multiple_source_rule": "additional sources create alternative source-coherent accepted_variants only",
        "forbidden": [
          "average",
          "cross_source_field_splice"
        ],
        "required_receipt_fields": [
          "source_id",
          "source_name",
          "source_response_sha256",
          "provider_quote_timestamp",
          "captured_at",
          "market_session",
          "timezone",
          "currency",
          "unit",
          "freshness",
          "tick"
        ],
        "capture_failure": "case_data_not_scored"
      }
    },
    {
      "case_id": "RTQ-014",
      "query_sha256": "501a944a33dd2d77c6a0e6b79272b82413a09c75afae6bfae3bd923a6420681d",
      "contract_status": "contract_frozen",
      "evaluation_mode": "runtime_snapshot",
      "expected_status": "success",
      "runtime_capture_required": true,
      "accepted_variant_policy": {
        "variant_rule": "one_complete_source_per_accepted_variant",
        "multiple_source_rule": "additional sources create alternative source-coherent accepted_variants only",
        "forbidden": [
          "average",
          "cross_source_field_splice"
        ],
        "required_receipt_fields": [
          "source_id",
          "source_name",
          "source_response_sha256",
          "provider_quote_timestamp",
          "captured_at",
          "market_session",
          "timezone",
          "currency",
          "unit",
          "freshness",
          "tick"
        ],
        "capture_failure": "case_data_not_scored"
      }
    },
    {
      "case_id": "RTQ-015",
      "query_sha256": "31dd0efcc20e0fc7762307791c04217c29eff677c0b5f768f4d90d836abfa0b0",
      "contract_status": "contract_frozen",
      "evaluation_mode": "runtime_snapshot",
      "expected_status": "success",
      "runtime_capture_required": true,
      "accepted_variant_policy": {
        "variant_rule": "one_complete_source_per_accepted_variant",
        "multiple_source_rule": "additional sources create alternative source-coherent accepted_variants only",
        "forbidden": [
          "average",
          "cross_source_field_splice"
        ],
        "required_receipt_fields": [
          "source_id",
          "source_name",
          "source_response_sha256",
          "provider_quote_timestamp",
          "captured_at",
          "market_session",
          "timezone",
          "currency",
          "unit",
          "freshness",
          "tick"
        ],
        "capture_failure": "case_data_not_scored"
      }
    },
    {
      "case_id": "RTQ-016",
      "query_sha256": "eeb4c506750f88cd629a889e9be8e60ed2bbbeb4838cf8c3657d3eb6d4cc3b48",
      "contract_status": "contract_frozen",
      "evaluation_mode": "runtime_snapshot",
      "expected_status": "success",
      "runtime_capture_required": true,
      "accepted_variant_policy": {
        "variant_rule": "one_complete_source_per_accepted_variant",
        "multiple_source_rule": "additional sources create alternative source-coherent accepted_variants only",
        "forbidden": [
          "average",
          "cross_source_field_splice"
        ],
        "required_receipt_fields": [
          "source_id",
          "source_name",
          "source_response_sha256",
          "provider_quote_timestamp",
          "captured_at",
          "market_session",
          "timezone",
          "currency",
          "unit",
          "freshness",
          "tick"
        ],
        "capture_failure": "case_data_not_scored"
      }
    },
    {
      "case_id": "RTQ-017",
      "query_sha256": "885d6b17831acff8086bee67175200b77ebfc65de3bb4730bc3c37c6261b3f18",
      "contract_status": "contract_frozen",
      "evaluation_mode": "runtime_snapshot",
      "expected_status": "success",
      "runtime_capture_required": true,
      "accepted_variant_policy": {
        "variant_rule": "one_complete_source_per_accepted_variant",
        "multiple_source_rule": "additional sources create alternative source-coherent accepted_variants only",